question_set_title,question_number,question_type,question_text,options,correct_answer,matching_pairs,labels,explanation,hint,marks,drawing_template
Programming & Computing 3,50,written,Explain why you should not click on links in emails from unknown senders.,,"Unknown links may contain viruses, lead to fake websites, or try to steal your personal information through phishing attacks.",,,,,3,
Digital Skills Assessment 4,1,mcq,What does the CPU do?,"[""Stores data permanently"", ""Processes instructions"", ""Displays images"", ""Prints documents""]",Processes instructions,,,,,1,
Digital Skills Assessment 4,2,written,Explain when you would use a bar chart instead of a line chart.,,Bar charts are used to compare different categories or groups. Line charts are used to show changes over time.,,,,,3,
Digital Skills Assessment 4,3,matching,Match the device to its type,,"Keyboard-Input, Monitor-Output, Hard Drive-Storage, Mouse-Input","[{""left"": ""Keyboard"", ""right"": ""Input""}, {""left"": ""Monitor"", ""right"": ""Output""}, {""left"": ""Hard Drive"", ""right"": ""Storage""}, {""left"": ""Mouse"", ""right"": ""Input""}]",,,,4,
Digital Skills Assessment 4,4,matching,Match the software to its purpose,,"Word-Writing documents, Excel-Making spreadsheets, PowerPoint-Creating presentations, Paint-Drawing pictures","[{""left"": ""Word"", ""right"": ""Writing documents""}, {""left"": ""Excel"", ""right"": ""Making spreadsheets""}, {""left"": ""PowerPoint"", ""right"": ""Creating presentations""}, {""left"": ""Paint"", ""right"": ""Drawing pictures""}]",,,,4,
Digital Skills Assessment 4,5,mcq,Which function adds up numbers in Excel?,"[""AVERAGE"", ""COUNT"", ""SUM"", ""MAX""]",SUM,,,,,1,
Digital Skills Assessment 4,6,fill_blank,USB stands for Universal _______ Bus.,,Serial,,,,,1,
Digital Skills Assessment 4,7,mcq,"In Excel, what is a cell?","[""A row"", ""A column"", ""The intersection of a row and column"", ""A formula""]",The intersection of a row and column,,,,,1,
Digital Skills Assessment 4,8,mcq,Which device converts printed documents into digital format?,"[""Printer"", ""Scanner"", ""Webcam"", ""Microphone""]",Scanner,,,,,1,
Digital Skills Assessment 4,9,fill_blank,CPU stands for _______ Processing Unit.,,Central,,,,,1,
Digital Skills Assessment 4,10,drawing,Complete the missing decision box in this flowchart for checking if someone can vote (age >= 18).,,"Decision diamond with ""Age >= 18?"" and Yes/No branches",,,,,3,"{""type"": ""flowchart"", ""instructions"": ""Fill in the missing decision""}"
Digital Skills Assessment 4,11,mcq,Which of these is an input device?,"[""Printer"", ""Speaker"", ""Keyboard"", ""Monitor""]",Keyboard,,,,,1,
Digital Skills Assessment 4,12,mcq,"In Scratch, which block makes a sprite move?","[""say"", ""move"", ""wait"", ""ask""]",move,,,,,1,
Digital Skills Assessment 4,13,mcq,What does the IF statement check?,"[""A condition"", ""A variable name"", ""A file"", ""A website""]",A condition,,,,,1,
Digital Skills Assessment 4,14,written,Explain the difference between system software and application software. Give one example of each.,,"System software (e.g., Windows) controls hardware and runs the computer. Application software (e.g., Word) helps users do specific tasks like writing documents.",,,,,3,
Digital Skills Assessment 4,15,fill_blank,Unwanted commercial email is called _______.,,spam,,,,,1,
Digital Skills Assessment 4,16,mcq,Which is personal information you should NOT share online?,"[""Your favorite color"", ""Your home address"", ""Your favorite book"", ""The weather""]",Your home address,,,,,1,
Digital Skills Assessment 4,17,mcq,Which is NOT an operating system?,"[""Windows"", ""macOS"", ""Linux"", ""Microsoft Office""]",Microsoft Office,,,,,1,
Digital Skills Assessment 4,18,written,Why is it important to update your operating system regularly?,,"Updates fix security problems, add new features, improve performance, and fix bugs that could cause the computer to malfunction.",,,,,3,
Digital Skills Assessment 4,19,drawing,"Draw and label a simple computer system showing: Monitor, CPU (System Unit), Keyboard, and Mouse.",,"Drawing showing monitor, CPU unit, keyboard, and mouse with labels",,,,,4,"{""type"": ""freehand"", ""instructions"": ""Draw a computer setup with 4 components labeled""}"
Digital Skills Assessment 4,20,mcq,What does WAN stand for?,"[""Wide Area Network"", ""Wireless Area Network"", ""Web Area Network"", ""World Area Network""]",Wide Area Network,,,,,1,
Digital Skills Assessment 4,21,mcq,What type of software is Microsoft Word?,"[""Operating system"", ""Word processor"", ""Web browser"", ""Game""]",Word processor,,,,,1,
Digital Skills Assessment 4,22,fill_blank,A _______ is a program that lets you view websites.,,browser,,,,,1,
Digital Skills Assessment 4,23,matching,Match the internet term to its meaning,,"Browser-Views websites, Email-Electronic mail, Password-Secret code to login, Download-Get files from internet","[{""left"": ""Browser"", ""right"": ""Views websites""}, {""left"": ""Email"", ""right"": ""Electronic mail""}, {""left"": ""Password"", ""right"": ""Secret code to login""}, {""left"": ""Download"", ""right"": ""Get files from internet""}]",,,,4,
Digital Skills Assessment 4,24,fill_blank,The worldwide network of computers is called the _______.,,internet,,,,,1,
Digital Skills Assessment 4,25,mcq,Which device connects a computer to the internet?,"[""Monitor"", ""Keyboard"", ""Router"", ""Speaker""]",Router,,,,,1,
Digital Skills Assessment 4,26,written,Explain why you should not click on links in emails from unknown senders.,,"Unknown links may contain viruses, lead to fake websites, or try to steal your personal information through phishing attacks.",,,,,3,
Digital Skills Assessment 4,27,mcq,What does WWW stand for?,"[""World Wide Web"", ""Wide World Web"", ""World Web Wide"", ""Web World Wide""]",World Wide Web,,,,,1,
Digital Skills Assessment 4,28,matching,Match the network device to its function,,"Router-Connects networks, Switch-Connects devices in LAN, Modem-Converts signals, Server-Stores and shares data","[{""left"": ""Router"", ""right"": ""Connects networks""}, {""left"": ""Switch"", ""right"": ""Connects devices in LAN""}, {""left"": ""Modem"", ""right"": ""Converts signals""}, {""left"": ""Server"", ""right"": ""Stores and shares data""}]",,,,4,
Digital Skills Assessment 4,29,mcq,What does antivirus software do?,"[""Makes computer faster"", ""Protects from malware"", ""Creates documents"", ""Plays music""]",Protects from malware,,,,,1,
Digital Skills Assessment 4,30,fill_blank,Rows in a spreadsheet are labeled with _______.,,numbers,,,,,1,
Digital Skills Assessment 4,31,fill_blank,HTTP stands for HyperText Transfer _______.,,Protocol,,,,,1,
Digital Skills Assessment 4,32,mcq,What does the lock icon in a browser address bar mean?,"[""Site is blocked"", ""Connection is secure"", ""Site is slow"", ""You cannot use the site""]",Connection is secure,,,,,1,
Digital Skills Assessment 4,33,drawing,Draw a flowchart for deciding if a number is positive or negative.,,"Flowchart with Start, Input number, Decision (>0?), Output positive/negative, End",,,,,5,"{""type"": ""flowchart"", ""instructions"": ""Use oval for start/end, diamond for decision, rectangle for process""}"
Digital Skills Assessment 4,34,mcq,What is phishing?,"[""A fishing game"", ""Trick emails to steal information"", ""A type of website"", ""A search engine""]",Trick emails to steal information,,,,,1,
Digital Skills Assessment 4,35,written,Write an algorithm (step-by-step instructions) for brushing your teeth.,,1. Pick up toothbrush. 2. Put toothpaste on brush. 3. Wet the brush. 4. Brush teeth for 2 minutes. 5. Rinse mouth. 6. Put brush away.,,,,,4,
Digital Skills Assessment 4,36,mcq,What symbol do formulas in Excel start with?,"[""#"", ""$"", ""="", ""@""]",=,,,,,1,
Digital Skills Assessment 4,37,mcq,Which is an output device?,"[""Mouse"", ""Keyboard"", ""Scanner"", ""Printer""]",Printer,,,,,1,
Digital Skills Assessment 4,38,drawing,Draw lines to connect each input device to the correct computer port.,,Lines connecting devices to appropriate ports,,,,,3,"{""type"": ""connect"", ""instructions"": ""Match devices to ports""}"
Digital Skills Assessment 4,39,mcq,What is a web browser used for?,"[""Create documents"", ""View websites"", ""Edit photos"", ""Play games only""]",View websites,,,,,1,
Digital Skills Assessment 4,40,mcq,Which software helps edit photos?,"[""Notepad"", ""Calculator"", ""Photoshop"", ""VLC""]",Photoshop,,,,,1,
Digital Skills Assessment 4,41,written,Explain why planning with a flowchart is important before writing code.,,"Flowcharts help visualize the logic, identify errors early, make code easier to write, and help others understand your plan.",,,,,3,
Digital Skills Assessment 4,42,mcq,Which software would you use to create a presentation?,"[""Excel"", ""Word"", ""PowerPoint"", ""Paint""]",PowerPoint,,,,,1,
Digital Skills Assessment 4,43,fill_blank,RAM stands for Random _______ Memory.,,Access,,,,,1,
Programming & Computing 5,1,mcq,What does the AVERAGE function do?,"[""Finds the total"", ""Finds the middle value"", ""Finds the mean"", ""Counts cells""]",Finds the mean,,,,,1,
Programming & Computing 5,2,matching,Match the device to its type,,"Keyboard-Input, Monitor-Output, Hard Drive-Storage, Mouse-Input","[{""left"": ""Keyboard"", ""right"": ""Input""}, {""left"": ""Monitor"", ""right"": ""Output""}, {""left"": ""Hard Drive"", ""right"": ""Storage""}, {""left"": ""Mouse"", ""right"": ""Input""}]",,,,4,
Programming & Computing 5,3,fill_blank,HTTP stands for HyperText Transfer _______.,,Protocol,,,,,1,
Programming & Computing 5,4,drawing,Draw a simple network diagram showing 4 computers connected to a router.,,Diagram with router in center and 4 computers connected to it,,,,,4,"{""type"": ""freehand"", ""instructions"": ""Draw a star topology with router in center""}"
Programming & Computing 5,5,mcq,What is phishing?,"[""A fishing game"", ""Trick emails to steal information"", ""A type of website"", ""A search engine""]",Trick emails to steal information,,,,,1,
Programming & Computing 5,6,fill_blank,Columns in a spreadsheet are labeled with _______.,,letters,,,,,1,
Programming & Computing 5,7,mcq,What does WWW stand for?,"[""World Wide Web"", ""Wide World Web"", ""World Web Wide"", ""Web World Wide""]",World Wide Web,,,,,1,
Programming & Computing 5,8,fill_blank,The brain of the computer is the _______.,,CPU,,,,,1,
Programming & Computing 5,9,drawing,Draw a flowchart for deciding if a number is positive or negative.,,"Flowchart with Start, Input number, Decision (>0?), Output positive/negative, End",,,,,5,"{""type"": ""flowchart"", ""instructions"": ""Use oval for start/end, diamond for decision, rectangle for process""}"
Programming & Computing 5,10,mcq,Which storage device can hold the most data?,"[""CD"", ""Floppy disk"", ""Hard drive"", ""USB stick (4GB)""]",Hard drive,,,,,1,
Programming & Computing 5,11,fill_blank,Software that damages computers is called _______.,,malware,,,,,1,
Programming & Computing 5,12,written,Explain the difference between system software and application software. Give one example of each.,,"System software (e.g., Windows) controls hardware and runs the computer. Application software (e.g., Word) helps users do specific tasks like writing documents.",,,,,3,
Programming & Computing 5,13,written,Give two advantages of using a computer network in a school.,,1. Share files and resources easily. 2. Share printers and internet connection. 3. Communicate through email. 4. Central storage and backup.,,,,,3,
Programming & Computing 5,14,written,List 3 rules for staying safe online.,,1. Never share personal information. 2. Use strong passwords. 3. Tell an adult if something makes you uncomfortable. 4. Only visit trusted websites.,,,,,3,
Programming & Computing 5,15,mcq,What does WAN stand for?,"[""Wide Area Network"", ""Wireless Area Network"", ""Web Area Network"", ""World Area Network""]",Wide Area Network,,,,,1,
Programming & Computing 5,16,written,Give three examples of input devices and explain what each does.,,1. Keyboard - allows typing text. 2. Mouse - allows pointing and clicking. 3. Microphone - allows recording sound.,,,,,3,
Programming & Computing 5,17,written,Explain why you should not click on links in emails from unknown senders.,,"Unknown links may contain viruses, lead to fake websites, or try to steal your personal information through phishing attacks.",,,,,3,
Programming & Computing 5,18,mcq,Which is a search engine?,"[""Facebook"", ""Google"", ""WhatsApp"", ""Word""]",Google,,,,,1,
Programming & Computing 5,19,mcq,Which is an output device?,"[""Mouse"", ""Keyboard"", ""Scanner"", ""Printer""]",Printer,,,,,1,
Programming & Computing 5,20,fill_blank,Rows in a spreadsheet are labeled with _______.,,numbers,,,,,1,
Programming & Computing 5,21,written,"A shop sells items at these prices: RM5, RM8, RM12, RM15. Write the formula to find the average price.",,"=AVERAGE(A1:A4) if prices are in cells A1 to A4, which equals RM10",,,,,2,
Programming & Computing 5,22,written,What should you do if you see cyberbullying online?,,"Do not respond, take screenshots as evidence, block the person, report it to the platform, and tell a trusted adult.",,,,,3,
Programming & Computing 5,23,written,Explain when you would use a bar chart instead of a line chart.,,Bar charts are used to compare different categories or groups. Line charts are used to show changes over time.,,,,,3,
Programming & Computing 5,24,matching,Match the internet term to its meaning,,"Browser-Views websites, Email-Electronic mail, Password-Secret code to login, Download-Get files from internet","[{""left"": ""Browser"", ""right"": ""Views websites""}, {""left"": ""Email"", ""right"": ""Electronic mail""}, {""left"": ""Password"", ""right"": ""Secret code to login""}, {""left"": ""Download"", ""right"": ""Get files from internet""}]",,,,4,
Programming & Computing 5,25,mcq,A spreadsheet software is used to:,"[""Write letters"", ""Organize data in rows and columns"", ""Draw pictures"", ""Play videos""]",Organize data in rows and columns,,,,,1,
Programming & Computing 5,26,fill_blank,A device that produces sound output is called a _______.,,speaker,,,,,1,
Programming & Computing 5,27,written,"Write the formula to add the values in cells B2, B3, B4, and B5.",,=SUM(B2:B5) or =B2+B3+B4+B5,,,,,2,
Programming & Computing 5,28,mcq,Which is personal information you should NOT share online?,"[""Your favorite color"", ""Your home address"", ""Your favorite book"", ""The weather""]",Your home address,,,,,1,
Programming & Computing 5,29,mcq,What is cyberbullying?,"[""Playing games online"", ""Sending mean messages online"", ""Using the internet"", ""Watching videos""]",Sending mean messages online,,,,,1,
Programming & Computing 5,30,mcq,What symbol do formulas in Excel start with?,"[""#"", ""$"", ""="", ""@""]",=,,,,,1,
Programming & Computing 5,31,written,Explain the difference between LAN and WAN.,,"LAN (Local Area Network) covers a small area like a school or home. WAN (Wide Area Network) covers large areas, even countries. The internet is the largest WAN.",,,,,3,
Programming & Computing 5,32,fill_blank,Microsoft Excel is a _______ application.,,spreadsheet,,,,,1,
Programming & Computing 5,33,drawing,Complete the missing decision box in this flowchart for checking if someone can vote (age >= 18).,,"Decision diamond with ""Age >= 18?"" and Yes/No branches",,,,,3,"{""type"": ""flowchart"", ""instructions"": ""Fill in the missing decision""}"
Programming & Computing 5,34,mcq,What does the IF statement check?,"[""A condition"", ""A variable name"", ""A file"", ""A website""]",A condition,,,,,1,
Programming & Computing 5,35,fill_blank,Unwanted commercial email is called _______.,,spam,,,,,1,
Programming & Computing 5,36,mcq,What type of software is Microsoft Word?,"[""Operating system"", ""Word processor"", ""Web browser"", ""Game""]",Word processor,,,,,1,
Programming & Computing 5,37,fill_blank,"To find the highest value, you use the _______ function.",,MAX,,,,,1,
Programming & Computing 5,38,fill_blank,A program that protects your computer from viruses is called _______ software.,,antivirus,,,,,1,
Programming & Computing 5,39,mcq,Which is NOT an operating system?,"[""Windows"", ""macOS"", ""Linux"", ""Microsoft Office""]",Microsoft Office,,,,,1,
Programming & Computing 5,40,mcq,Which chart type is best for showing parts of a whole?,"[""Line chart"", ""Bar chart"", ""Pie chart"", ""Scatter plot""]",Pie chart,,,,,1,
Programming & Computing 5,41,fill_blank,The formula =A1+B1 will _______ the values in cells A1 and B1.,,add,,,,,1,
Programming & Computing 5,42,fill_blank,URL stands for Uniform Resource _______.,,Locator,,,,,1,
Programming & Computing 5,43,mcq,Which of these is an input device?,"[""Printer"", ""Speaker"", ""Keyboard"", ""Monitor""]",Keyboard,,,,,1,
Programming & Computing 5,44,mcq,What should you do if a stranger online asks for your address?,"[""Give it to them"", ""Ask your parents first"", ""Never share and tell an adult"", ""Share if they seem nice""]",Never share and tell an adult,,,,,1,
Programming & Computing 5,45,mcq,What does the CPU do?,"[""Stores data permanently"", ""Processes instructions"", ""Displays images"", ""Prints documents""]",Processes instructions,,,,,1,
Programming & Computing 5,46,drawing,Draw lines to connect each input device to the correct computer port.,,Lines connecting devices to appropriate ports,,,,,3,"{""type"": ""connect"", ""instructions"": ""Match devices to ports""}"
Programming & Computing 5,47,matching,Match the function to what it does,,"SUM-Adds numbers, AVERAGE-Finds mean, MAX-Finds highest, MIN-Finds lowest","[{""left"": ""SUM"", ""right"": ""Adds numbers""}, {""left"": ""AVERAGE"", ""right"": ""Finds mean""}, {""left"": ""MAX"", ""right"": ""Finds highest""}, {""left"": ""MIN"", ""right"": ""Finds lowest""}]",,,,4,
Technology Fundamentals 6,1,mcq,What is an algorithm?,"[""A type of computer"", ""Step-by-step instructions"", ""A programming language"", ""A website""]",Step-by-step instructions,,,,,1,
Technology Fundamentals 6,2,fill_blank,A set of step-by-step instructions to solve a problem is called an _______.,,algorithm,,,,,1,
Technology Fundamentals 6,3,mcq,A network of computers within a school is called:,"[""WAN"", ""LAN"", ""MAN"", ""Internet""]",LAN,,,,,1,
Technology Fundamentals 6,4,written,"A shop sells items at these prices: RM5, RM8, RM12, RM15. Write the formula to find the average price.",,"=AVERAGE(A1:A4) if prices are in cells A1 to A4, which equals RM10",,,,,2,
Technology Fundamentals 6,5,written,Give three examples of input devices and explain what each does.,,1. Keyboard - allows typing text. 2. Mouse - allows pointing and clicking. 3. Microphone - allows recording sound.,,,,,3,
Technology Fundamentals 6,6,fill_blank,The software that controls all computer hardware is called the _______ system.,,operating,,,,,1,
Technology Fundamentals 6,7,fill_blank,A _______ is used to repeat code until a condition is met.,,loop,,,,,1,
Technology Fundamentals 6,8,mcq,What does the IF statement check?,"[""A condition"", ""A variable name"", ""A file"", ""A website""]",A condition,,,,,1,
Technology Fundamentals 6,9,fill_blank,The flowchart symbol for start and end is an _______.,,oval,,,,,1,
Technology Fundamentals 6,10,fill_blank,The worldwide network of computers is called the _______.,,internet,,,,,1,
Technology Fundamentals 6,11,mcq,Which device converts printed documents into digital format?,"[""Printer"", ""Scanner"", ""Webcam"", ""Microphone""]",Scanner,,,,,1,
Technology Fundamentals 6,12,written,Explain when you would use a bar chart instead of a line chart.,,Bar charts are used to compare different categories or groups. Line charts are used to show changes over time.,,,,,3,
Technology Fundamentals 6,13,written,Give two advantages of using a computer network in a school.,,1. Share files and resources easily. 2. Share printers and internet connection. 3. Communicate through email. 4. Central storage and backup.,,,,,3,
Technology Fundamentals 6,14,written,Write an algorithm (step-by-step instructions) for brushing your teeth.,,1. Pick up toothbrush. 2. Put toothpaste on brush. 3. Wet the brush. 4. Brush teeth for 2 minutes. 5. Rinse mouth. 6. Put brush away.,,,,,4,
Technology Fundamentals 6,15,mcq,What type of software is Microsoft Word?,"[""Operating system"", ""Word processor"", ""Web browser"", ""Game""]",Word processor,,,,,1,
Technology Fundamentals 6,16,written,"Write the formula to add the values in cells B2, B3, B4, and B5.",,=SUM(B2:B5) or =B2+B3+B4+B5,,,,,2,
Technology Fundamentals 6,17,mcq,"In Excel, what is a cell?","[""A row"", ""A column"", ""The intersection of a row and column"", ""A formula""]",The intersection of a row and column,,,,,1,
Technology Fundamentals 6,18,mcq,Which is an output device?,"[""Mouse"", ""Keyboard"", ""Scanner"", ""Printer""]",Printer,,,,,1,
Technology Fundamentals 6,19,written,Explain the difference between system software and application software. Give one example of each.,,"System software (e.g., Windows) controls hardware and runs the computer. Application software (e.g., Word) helps users do specific tasks like writing documents.",,,,,3,
Technology Fundamentals 6,20,mcq,What is WiFi?,"[""A cable connection"", ""Wireless internet connection"", ""A computer brand"", ""A type of software""]",Wireless internet connection,,,,,1,
Technology Fundamentals 6,21,mcq,Which chart type is best for showing parts of a whole?,"[""Line chart"", ""Bar chart"", ""Pie chart"", ""Scatter plot""]",Pie chart,,,,,1,
Technology Fundamentals 6,22,matching,Match the software to its purpose,,"Word-Writing documents, Excel-Making spreadsheets, PowerPoint-Creating presentations, Paint-Drawing pictures","[{""left"": ""Word"", ""right"": ""Writing documents""}, {""left"": ""Excel"", ""right"": ""Making spreadsheets""}, {""left"": ""PowerPoint"", ""right"": ""Creating presentations""}, {""left"": ""Paint"", ""right"": ""Drawing pictures""}]",,,,4,
Technology Fundamentals 6,23,mcq,What does the AVERAGE function do?,"[""Finds the total"", ""Finds the middle value"", ""Finds the mean"", ""Counts cells""]",Finds the mean,,,,,1,
Technology Fundamentals 6,24,fill_blank,Microsoft Excel is a _______ application.,,spreadsheet,,,,,1,
Technology Fundamentals 6,25,matching,Match the function to what it does,,"SUM-Adds numbers, AVERAGE-Finds mean, MAX-Finds highest, MIN-Finds lowest","[{""left"": ""SUM"", ""right"": ""Adds numbers""}, {""left"": ""AVERAGE"", ""right"": ""Finds mean""}, {""left"": ""MAX"", ""right"": ""Finds highest""}, {""left"": ""MIN"", ""right"": ""Finds lowest""}]",,,,4,
Technology Fundamentals 6,26,drawing,Draw a simple network diagram showing 4 computers connected to a router.,,Diagram with router in center and 4 computers connected to it,,,,,4,"{""type"": ""freehand"", ""instructions"": ""Draw a star topology with router in center""}"
Technology Fundamentals 6,27,mcq,Which function adds up numbers in Excel?,"[""AVERAGE"", ""COUNT"", ""SUM"", ""MAX""]",SUM,,,,,1,
Technology Fundamentals 6,28,mcq,What symbol is used for a decision in a flowchart?,"[""Rectangle"", ""Diamond"", ""Oval"", ""Circle""]",Diamond,,,,,1,
Technology Fundamentals 6,29,mcq,Which is NOT an operating system?,"[""Windows"", ""macOS"", ""Linux"", ""Microsoft Office""]",Microsoft Office,,,,,1,
Technology Fundamentals 6,30,fill_blank,USB stands for Universal _______ Bus.,,Serial,,,,,1,
Technology Fundamentals 6,31,matching,Match the device to its type,,"Keyboard-Input, Monitor-Output, Hard Drive-Storage, Mouse-Input","[{""left"": ""Keyboard"", ""right"": ""Input""}, {""left"": ""Monitor"", ""right"": ""Output""}, {""left"": ""Hard Drive"", ""right"": ""Storage""}, {""left"": ""Mouse"", ""right"": ""Input""}]",,,,4,
Technology Fundamentals 6,32,fill_blank,URL stands for Uniform Resource _______.,,Locator,,,,,1,
Technology Fundamentals 6,33,mcq,Which is a safe password practice?,"[""Use \""password123\"""", ""Share with friends"", ""Use mix of letters, numbers, symbols"", ""Use your birthday""]","Use mix of letters, numbers, symbols",,,,,1,
Technology Fundamentals 6,34,fill_blank,A device that produces sound output is called a _______.,,speaker,,,,,1,
Technology Fundamentals 6,35,mcq,What does the lock icon in a browser address bar mean?,"[""Site is blocked"", ""Connection is secure"", ""Site is slow"", ""You cannot use the site""]",Connection is secure,,,,,1,
Technology Fundamentals 6,36,mcq,What is phishing?,"[""A fishing game"", ""Trick emails to steal information"", ""A type of website"", ""A search engine""]",Trick emails to steal information,,,,,1,
Technology Fundamentals 6,37,mcq,"In Scratch, which block makes a sprite move?","[""say"", ""move"", ""wait"", ""ask""]",move,,,,,1,
Technology Fundamentals 6,38,mcq,Which of these is an input device?,"[""Printer"", ""Speaker"", ""Keyboard"", ""Monitor""]",Keyboard,,,,,1,
Technology Fundamentals 6,39,mcq,Which is a search engine?,"[""Facebook"", ""Google"", ""WhatsApp"", ""Word""]",Google,,,,,1,
Technology Fundamentals 6,40,written,Why is it important to update your operating system regularly?,,"Updates fix security problems, add new features, improve performance, and fix bugs that could cause the computer to malfunction.",,,,,3,
ICT Knowledge Test 7,1,mcq,What is a touchscreen?,"[""Only input device"", ""Only output device"", ""Both input and output device"", ""Storage device""]",Both input and output device,,,,,1,
ICT Knowledge Test 7,2,fill_blank,Columns in a spreadsheet are labeled with _______.,,letters,,,,,1,
ICT Knowledge Test 7,3,fill_blank,HTTP stands for HyperText Transfer _______.,,Protocol,,,,,1,
