question_set_title,question_number,question_type,question_text,options,correct_answer,matching_pairs,labels,explanation,hint,marks,drawing_template
Programming & Computing 10,11,mcq,What is WiFi?,"[""A cable connection"", ""Wireless internet connection"", ""A computer brand"", ""A type of software""]",Wireless internet connection,,,,,1,
Programming & Computing 10,12,mcq,"In Excel, what is a cell?","[""A row"", ""A column"", ""The intersection of a row and column"", ""A formula""]",The intersection of a row and column,,,,,1,
Programming & Computing 10,13,mcq,What does the AVERAGE function do?,"[""Finds the total"", ""Finds the middle value"", ""Finds the mean"", ""Counts cells""]",Finds the mean,,,,,1,
Programming & Computing 10,14,fill_blank,CPU stands for _______ Processing Unit.,,Central,,,,,1,
Programming & Computing 10,15,mcq,Which chart type is best for showing parts of a whole?,"[""Line chart"", ""Bar chart"", ""Pie chart"", ""Scatter plot""]",Pie chart,,,,,1,
Programming & Computing 10,16,written,Explain why planning with a flowchart is important before writing code.,,"Flowcharts help visualize the logic, identify errors early, make code easier to write, and help others understand your plan.",,,,,3,
Programming & Computing 10,17,written,Why is it important to update your operating system regularly?,,"Updates fix security problems, add new features, improve performance, and fix bugs that could cause the computer to malfunction.",,,,,3,
Programming & Computing 10,18,mcq,Which storage device can hold the most data?,"[""CD"", ""Floppy disk"", ""Hard drive"", ""USB stick (4GB)""]",Hard drive,,,,,1,
Programming & Computing 10,19,mcq,Which function adds up numbers in Excel?,"[""AVERAGE"", ""COUNT"", ""SUM"", ""MAX""]",SUM,,,,,1,
Programming & Computing 10,20,drawing,"Draw and label a simple computer system showing: Monitor, CPU (System Unit), Keyboard, and Mouse.",,"Drawing showing monitor, CPU unit, keyboard, and mouse with labels",,,,,4,"{""type"": ""freehand"", ""instructions"": ""Draw a computer setup with 4 components labeled""}"
Programming & Computing 10,21,matching,Match the function to what it does,,"SUM-Adds numbers, AVERAGE-Finds mean, MAX-Finds highest, MIN-Finds lowest","[{""left"": ""SUM"", ""right"": ""Adds numbers""}, {""left"": ""AVERAGE"", ""right"": ""Finds mean""}, {""left"": ""MAX"", ""right"": ""Finds highest""}, {""left"": ""MIN"", ""right"": ""Finds lowest""}]",,,,4,
Programming & Computing 10,22,written,"Write the formula to add the values in cells B2, B3, B4, and B5.",,=SUM(B2:B5) or =B2+B3+B4+B5,,,,,2,
Programming & Computing 10,23,drawing,Draw lines to connect each input device to the correct computer port.,,Lines connecting devices to appropriate ports,,,,,3,"{""type"": ""connect"", ""instructions"": ""Match devices to ports""}"
Programming & Computing 10,24,written,What should you do if you see cyberbullying online?,,"Do not respond, take screenshots as evidence, block the person, report it to the platform, and tell a trusted adult.",,,,,3,
Programming & Computing 10,25,fill_blank,"To find the highest value, you use the _______ function.",,MAX,,,,,1,
Programming & Computing 10,26,fill_blank,RAM stands for Random _______ Memory.,,Access,,,,,1,
Programming & Computing 10,27,mcq,Which of these is an input device?,"[""Printer"", ""Speaker"", ""Keyboard"", ""Monitor""]",Keyboard,,,,,1,
Programming & Computing 10,28,mcq,A network of computers within a school is called:,"[""WAN"", ""LAN"", ""MAN"", ""Internet""]",LAN,,,,,1,
Programming & Computing 10,29,mcq,"In Scratch, which block makes a sprite move?","[""say"", ""move"", ""wait"", ""ask""]",move,,,,,1,
Programming & Computing 10,30,mcq,What is a variable in programming?,"[""A fixed number"", ""A container that stores data"", ""A type of loop"", ""A hardware part""]",A container that stores data,,,,,1,
Programming & Computing 10,31,drawing,Draw a simple network diagram showing 4 computers connected to a router.,,Diagram with router in center and 4 computers connected to it,,,,,4,"{""type"": ""freehand"", ""instructions"": ""Draw a star topology with router in center""}"
Programming & Computing 10,32,fill_blank,A _______ is used to repeat code until a condition is met.,,loop,,,,,1,
Programming & Computing 10,33,matching,Match the software to its purpose,,"Word-Writing documents, Excel-Making spreadsheets, PowerPoint-Creating presentations, Paint-Drawing pictures","[{""left"": ""Word"", ""right"": ""Writing documents""}, {""left"": ""Excel"", ""right"": ""Making spreadsheets""}, {""left"": ""PowerPoint"", ""right"": ""Creating presentations""}, {""left"": ""Paint"", ""right"": ""Drawing pictures""}]",,,,4,
Programming & Computing 10,34,mcq,Which structure repeats a block of code multiple times?,"[""Selection"", ""Loop"", ""Sequence"", ""Variable""]",Loop,,,,,1,
Programming & Computing 10,35,fill_blank,A computer that provides services to other computers is called a _______.,,server,,,,,1,
Programming & Computing 10,36,fill_blank,A device that produces sound output is called a _______.,,speaker,,,,,1,
Programming & Computing 10,37,mcq,What does the lock icon in a browser address bar mean?,"[""Site is blocked"", ""Connection is secure"", ""Site is slow"", ""You cannot use the site""]",Connection is secure,,,,,1,
Programming & Computing 10,38,mcq,Which is a search engine?,"[""Facebook"", ""Google"", ""WhatsApp"", ""Word""]",Google,,,,,1,
Programming & Computing 10,39,mcq,Which is an output device?,"[""Mouse"", ""Keyboard"", ""Scanner"", ""Printer""]",Printer,,,,,1,
Programming & Computing 10,40,fill_blank,Rows in a spreadsheet are labeled with _______.,,numbers,,,,,1,
Programming & Computing 10,41,fill_blank,Microsoft Excel is a _______ application.,,spreadsheet,,,,,1,
Programming & Computing 10,42,matching,Match the network device to its function,,"Router-Connects networks, Switch-Connects devices in LAN, Modem-Converts signals, Server-Stores and shares data","[{""left"": ""Router"", ""right"": ""Connects networks""}, {""left"": ""Switch"", ""right"": ""Connects devices in LAN""}, {""left"": ""Modem"", ""right"": ""Converts signals""}, {""left"": ""Server"", ""right"": ""Stores and shares data""}]",,,,4,
Programming & Computing 10,43,fill_blank,Software that is free to use is called _______ software.,,freeware,,,,,1,
Programming & Computing 10,44,fill_blank,URL stands for Uniform Resource _______.,,Locator,,,,,1,
Programming & Computing 10,45,mcq,Which software helps edit photos?,"[""Notepad"", ""Calculator"", ""Photoshop"", ""VLC""]",Photoshop,,,,,1,
